question,key sentences,keywords,answer,file,page
How is the Segment Tree converted into a persistent data structure?,"This allows to access any version of this data structure that interest us and execute a query on it.; So if we store the Segment Tree using pointers (i.e. a vertex stores pointers to the left and the right child vertices).; New vertices will be created, including a new root vertex of the Segment Tree.",persistent; Segment Tree,"By storing the Segment Tree using pointers, where each vertex stores pointers to its left and right child vertices.",data/Segment_Tree.pdf,21
"What is the time complexity for the simplest Segment Tree implementation when there are queries asking for sums, and modification queries of single elements?","when there is only a query asking for sums, and modification queries of single elements.",time complexity; Segment Tree,O(logn),data/Segment_Tree.pdf,21
What is the time complexity for a single query in the persistent Segment Tree?,We will accomplish the same task using a persistent Segment Tree in.; First we will discuss a solution for a simpler problem: We will only consider arrays in which the element s are bound by . And we only want to  nd the -th smallest element  in some pre x of the array.,persistent Segment Tree; single query,O(1),data/Segment_Tree.pdf,22
How is the -th smallest number in a range found using a Segment Tree?,We will discuss a solution for a simpler problem: We will only consider arrays in which the element s are bound by . And we only want to  find the -th smallest element  in some prex of the array.; In other words we create a regular Segment Tree with sum queries over the histogram of the array.,Segment Tree; -th smallest number,"Using a Segment Tree, you can find the -th smallest number in a range by creating a persistent data structure that counts all appearing numbers and then querying it for the position of the -th element.",data/Segment_Tree.pdf,22
"How can we build a persistent Segment Tree over an array with elements in the range [0, MAX_VALUE]?","We need to store the root of the initial Segment Tree, and also all the roots after each update.; Here is the code for building a persistent Segment Tree over an vector a with element s in the range [0, MAX_VALUE].; Now to the restrictions on the array elemen ts: We can actually transform any array to such an array by index compression.",persistent Segment Tree; array with elements; MAX_VALUE,We build it by storing the root of the initial Segment Tree and updating all roots after each update.,data/Segment_Tree.pdf,23
How is the Segment Tree built in terms of recursion?,"It is easy to see that such a Segment Tree is just the difference between the Segment Tree rooted at and the Segment Tree rooted at, i.e. every vertex in the Segment Tree can be computed with the vertex of the tree minus the vertex of the tree.; Here are the modified , and functions",Segment Tree; recursion,The Segment Tree is built recursively.,data/Segment_Tree.pdf,23
How can we find the 5th smallest number from a subarray?,"It is easy to see that such a Segment Tree is just the difference between the Segment Tree rooted at and the Segment Tree rooted at, i.e. every vertex in the Segment Tree can be computed with the vertex of the tree minus the vertex of the tree.; Now to the restrictions on the array elements: We can actually transform any array to such an array by index compression.",Segment Tree; 5th smallest,find_kth,data/Segment_Tree.pdf,23
What is the purpose of creating a segment tree lazily?,"We can solve this problem by creating a segment tree lazily (incrementally).; Initially, we will create only the root, and we will create the other vertexes only when we need them.",segment tree; lazy,"The purpose is to create the segment tree incrementally, only as needed, starting with the root.",data/Segment_Tree.pdf,24
What is the complexity of query operations in a dynamic segment tree?,"We can solve this problem by creating a segment tree lazily (incrementally). Initially, we will create only the root, and we will create the other vertices only when we need them.; Each query has still only the complexity , which is small enough for most use-cases.",dynamic; segment tree; query operations,O(logn),data/Segment_Tree.pdf,24
What is the data structure used to implement dynamic segment trees?,"Dynamic segment tree; Called so because its shape is dynamic and the nodes are usually dynamically allocated.; Previously, we considered cases when we have the ability to build the original segment tree.",dynamic segment tree,Dynamic segment tree,data/Segment_Tree.pdf,24
How do you implement range updates via lazy propagation?,Obviously this idea can be extended in lots of different ways.; E.g. by adding support for range updates via lazy propagation.,range updates; lazy propagation,You can implement range updates via lazy propagation by extending the idea to add support for such updates.,data/Segment_Tree.pdf,25
How can this idea be extended?,This idea can be extended in lots of different ways.; E.g. by adding support for range updates via lazy propagation.,lazy propagation,by adding support for range updates via lazy propagation.,data/Segment_Tree.pdf,25
